Tweet Content,Date,User,Source,Tweet ID,Tweet URL
Nine #SEO Trends to Keep Pace With in 2019 https://t.co/DEUkksHkZL https://t.co/Nt14ZTpEZF,2019-05-23 18:19:01,LandingScout,Buffer,1131625597870985216,https://twitter.com/statuses/1131625597870985216
How to Create a Web Marketing Strategy on a Tight Budget https://t.co/iXUzpULsYW #SEO #Marketing,2019-05-23 18:18:09,SEO_Hacker,SocialOomph,1131625376768319489,https://twitter.com/statuses/1131625376768319489
"With the SERP as volatile as it is, knowing where you rank isn't enough!

To truly understand your ranking behavior you must observe the ranking trends.

Learn why your tracking methods may be outdated and how to keep on 'track' in 2019!

https://t.co/mxiL6i6tuW

#RankTrack #SEO",2019-05-23 18:15:15,RankRanger,Hootsuite Inc.,1131624648066633728,https://twitter.com/statuses/1131624648066633728
Want to know if the links to your site are harmful? Check these tips! https://t.co/xNEsjIneAp #SEO https://t.co/f7cU3llG88,2019-05-23 18:12:20,lnkresearchtool,SocialOomph,1131623913547587584,https://twitter.com/statuses/1131623913547587584
"If branding is important, don't worry about hyphenated domain names, if you aren't building a brand consider an hyphenated domain for that small ranking boost: it's small, don't worry about it too much. #SEO #Quotes - David Law",2019-05-23 18:10:02,SEOGoldUK,seotweetnow,1131623333986951168,https://twitter.com/statuses/1131623333986951168
19 ACTIONABLE Link Building Strategies (With Examples and Scripts) https://t.co/MXhIEbQzQz #SEO https://t.co/PhRbtz1DLD,2019-05-23 18:10:01,RickRockMex,Buffer,1131623332980449281,https://twitter.com/statuses/1131623332980449281
"If you are interested in writing, editing, analytics and strategizing, then you should apply for our open position as #SEO Content Marketer. Learn more about the responsibilities and qualifications here: https://t.co/8AuzP0oE7j https://t.co/PnHqETBgzm",2019-05-23 18:09:02,CarnegieDartlet,Buffer,1131623082899234816,https://twitter.com/statuses/1131623082899234816
The Best #SEO Plugins for All Major Platforms [The Complete List] https://t.co/byR4Gr01B7 @cognitiveSEO,2019-05-23 18:05:05,cjenkinsiv,Buffer,1131622090824716288,https://twitter.com/statuses/1131622090824716288
"SEMrush Pricing Plans: Which One is Best for You? If this is a question you need answers to, you're in the right place!  https://t.co/E4AO1aFUxS via @ecomplatforms #SEO",2019-05-23 18:05:00,ToddALee,Buffer,1131622068976521218,https://twitter.com/statuses/1131622068976521218
Rural Local SEO: A Marketing Package Strong on Education https://t.co/PP53pkWWu2 #SEO https://t.co/HuThb2Xf5g,2019-05-23 18:02:01,chuckaikens,Buffer,1131621319429283840,https://twitter.com/statuses/1131621319429283840
"You know what, its time YOU went to an #SEO conference. https://t.co/1fjIi5OLjP",2019-05-23 18:00:32,SEOisWAR,IFTTT,1131620945427349506,https://twitter.com/statuses/1131620945427349506
"Check out my blog, for all the latest in #SEO https://t.co/oY8V3uoybN",2019-05-23 18:00:18,SEOisWAR,IFTTT,1131620888284147713,https://twitter.com/statuses/1131620888284147713
Let's get into detail on the common types of content formats used in link building and look at the pros and cons of each one. https://t.co/8kHR2ejliI via @sengineland #SEO,2019-05-23 18:00:08,Barker_Social,Cloud Campaign,1131620843086405635,https://twitter.com/statuses/1131620843086405635
SearchSpring acquired by venture equity firm Scaleworks - https://t.co/DJdvHmKUId #SEO,2019-05-23 17:58:00,UKPR_News,Buffer,1131620309004632065,https://twitter.com/statuses/1131620309004632065
Top 7 factors that influence your local #searchrankings in 2019 - https://t.co/8vuxl3kCnI #SEO,2019-05-23 17:57:01,tampaseoagency,Buffer,1131620058529243136,https://twitter.com/statuses/1131620058529243136
Google SEO Myth Busting Video On GoogleBot https://t.co/BIq0CIDE5S #seo https://t.co/OhHmpyhDQm,2019-05-23 17:56:30,capturehits,Social Media Publisher App ,1131619930342694912,https://twitter.com/statuses/1131619930342694912
The latest The Content Marketing Report! https://t.co/0JI7LsOGB1 #digitalmarketing #seo,2019-05-23 17:56:19,edwindearborn,Paper.li,1131619884700454912,https://twitter.com/statuses/1131619884700454912
Guest Blogging: What It Can Do For Your Business Brand & SEO Strategy https://t.co/XwfKnVIX4n #seo,2019-05-23 17:55:15,CraigFaulkner_,Paper.li,1131619614503383041,https://twitter.com/statuses/1131619614503383041
Google Deep Neural Network Bounce Rate Tests #Google #SEO https://t.co/bpFsjQTPYc,2019-05-23 17:54:01,SEOGoldUK,seotweetnow,1131619304749723648,https://twitter.com/statuses/1131619304749723648
21 Ways to Triple Your B2B E-Commerce Conversions https://t.co/Mu03dIP5Ce via @moz #SEO https://t.co/XR7ALK9AEp,2019-05-23 17:51:33,jasoncreation,Twibble.io,1131618683284070401,https://twitter.com/statuses/1131618683284070401
SearchSpring acquired by venture equity firm Scaleworks https://t.co/AldESM9TXl #seo #ppc https://t.co/G5xnX7ObCv,2019-05-23 17:46:06,capturehits,Social Media Publisher App ,1131617312384143375,https://twitter.com/statuses/1131617312384143375
#BusinessShowcase from https://t.co/U4SnJryjRu: https://t.co/XlXzgz8pnr #SEO https://t.co/k9OKIb3VWp https://t.co/zWk0Se9Wsu,2019-05-23 17:45:13,homegardenlist,Hootsuite Inc.,1131617091415625728,https://twitter.com/statuses/1131617091415625728
"Web predictions indicate that 80% of time on the internet will be spent watching videos. How will that help your SEO? Embedded video on your landing page can improve bounce rate and time spent on your site, which Google sees as an indicator of strong content. #SEO https://t.co/U06aTlGUa3",2019-05-23 17:45:04,socialite_llc,Likeable Local,1131617052828065792,https://twitter.com/statuses/1131617052828065792
21 Ways to Triple Your B2B E-Commerce Conversions https://t.co/CWZywIF8m0 #SEO #Digital,2019-05-23 17:42:51,shafiqulhasan81,Zapier.com,1131616495090450433,https://twitter.com/statuses/1131616495090450433
Local #SEO strategy 101: Everything you need to know for geo-targeted content #Marketing    https://t.co/WkHzxwD8Mb,2019-05-23 17:42:14,ContentMaker1,IFTTT,1131616340979212288,https://twitter.com/statuses/1131616340979212288
21 Ways to Triple Your B2B E-Commerce Conversions https://t.co/CZUZr7JL9p #MOZ #SEO,2019-05-23 17:42:06,outblogging,IFTTT,1131616305600241670,https://twitter.com/statuses/1131616305600241670
#BizShowcase from https://t.co/M3fhEaePKG: https://t.co/UjCgyUfERg #SEO https://t.co/BbzsWwfd2R https://t.co/C9C3ct24AL,2019-05-23 17:40:09,banners_maker,Hootsuite Inc.,1131615815160205312,https://twitter.com/statuses/1131615815160205312
21 Ways to Triple Your B2B E-Commerce Conversions #seo https://t.co/CokDBVjwR1,2019-05-23 17:38:10,minneapolisseo1,IFTTT,1131615315543101441,https://twitter.com/statuses/1131615315543101441
FREE #SEO balance! https://t.co/gYZPfxFc2q,2019-05-23 17:37:59,hosttg,Twitter Web Client,1131615269636530178,https://twitter.com/statuses/1131615269636530178
"Some SEO experts believe linking to highly ranked relevant webpages helps, my #SEO tests are inconclusive. - David Law",2019-05-23 17:36:01,GrowthHackSEO,seotweetnow,1131614777266954240,https://twitter.com/statuses/1131614777266954240
21 Ways to Triple Your B2B E-Commerce Conversions https://t.co/KEoT8D7aUX #seo #moz,2019-05-23 17:35:19,compute_cumbria,IFTTT,1131614597969055744,https://twitter.com/statuses/1131614597969055744
"#SEO #CMS GitHub Launches New Sponsors Tool, Total War: THREE KINGDOMS Is Out on Linux, IBM Announces Expansion of its IBM Watson Decision Platform for Agriculture, Elisa 0.4.0 Released and NASA Deploys Astrobee Robots Running Ubun https://t.co/Vpzn4kGoLx https://t.co/DDt5bxv95u",2019-05-23 17:35:04,synapticwebco,SynapticWeb Auto-Tweet,1131614537713618945,https://twitter.com/statuses/1131614537713618945
https://t.co/HBll8zKPhS vs. https://t.co/VNdVw0N9LQ saga shows the importance of #SEO (and the bad side of a #Google update)    https://t.co/VanKt2fBqv,2019-05-23 17:33:15,_BoostTraffic,IFTTT,1131614077434978304,https://twitter.com/statuses/1131614077434978304
#SEO Trends to Watch Out for in 2017 via @brightvessel https://t.co/yQDfTTCAAv,2019-05-23 17:32:01,FBAcoaching,Buffer,1131613768117571584,https://twitter.com/statuses/1131613768117571584
The Ultimate Guide to #SEO for Beginners by @lilachbullock https://t.co/PQqzD4CYXd,2019-05-23 17:32:00,ToddALee,Buffer,1131613764409806848,https://twitter.com/statuses/1131613764409806848
Guest Blogging: What It Can Do For Your Business Brand & SEO Strategy https://t.co/rdRy1DZwKT #seo,2019-05-23 17:31:31,keithbdixon,Paper.li,1131613641202196482,https://twitter.com/statuses/1131613641202196482
https://t.co/k0ZCIqTFff 11 SEO Myths You Need To Stop Believing Today #SEO #search https://t.co/R5KXgxHOXA https://t.co/We469dnPmo jeffbullas,2019-05-23 17:31:23,thenameisaa,IFTTT,1131613610722156546,https://twitter.com/statuses/1131613610722156546
11 SEO Myths You Need To Stop Believing Today #SEO #search https://t.co/iM9TJQJ6wt https://t.co/kdrodzV98j,2019-05-23 17:30:08,jeffbullas,AgoraPulse Manager,1131613292735152128,https://twitter.com/statuses/1131613292735152128
Get a better idea of how your web pages are performing. Here's how you can do a one-page analysis in #GoogleAnalytics: https://t.co/jsazThrJ9j #SEO https://t.co/DKxt53xo39,2019-05-23 17:29:59,wsiworld,HubSpot,1131613259088486400,https://twitter.com/statuses/1131613259088486400
The Language Of #SEO: Identifying And Implementing Central #Keywords    https://t.co/6gmA64Lb9O,2019-05-23 17:28:11,_ArticleMaker,IFTTT,1131612805428326400,https://twitter.com/statuses/1131612805428326400
Anatomy of a Webpage: How to Maximize #SEO Impact    https://t.co/tOp9BXPmOG,2019-05-23 17:22:13,RSS_to_Email,IFTTT,1131611302017871872,https://twitter.com/statuses/1131611302017871872
"#OnlineMarketing News: Short Attention Spans, Google Feed Rules, Starbucks Emojis: https://t.co/oWIYwppDdv #seo https://t.co/SC55urDdXg",2019-05-23 17:20:13,alvinlindsay21,The Social Jukebox,1131610797690556416,https://twitter.com/statuses/1131610797690556416
Follow These 15 Slightly Dodgy Tips for #SEO Success,2019-05-23 17:16:55,wearebaitly,"Cheap Bots, Done Quick!",1131609966983426049,https://twitter.com/statuses/1131609966983426049
#SEO Tip Try and use keywords in your internet profiles this will help increase the chances of getting more traffic back to your website,2019-05-23 17:16:15,MidwebServices,The Social Jukebox,1131609801170014208,https://twitter.com/statuses/1131609801170014208
Run a pub or restaurant? Add your website to https://t.co/qIXYAdI1Q7 and gain #seo value https://t.co/41IGLU6Nso,2019-05-23 17:15:15,youcanbhealthy,Hootsuite Inc.,1131609548714848259,https://twitter.com/statuses/1131609548714848259
"How can you create SEO content at scale? It's all about the process, says @kathrynhawkins https://t.co/zNhlq7ENgo #seo #contentmarketing",2019-05-23 17:14:00,diamondrcreate,Buffer,1131609236784472065,https://twitter.com/statuses/1131609236784472065
Master local and #mobile w/ BernieColeman's free guide https://t.co/LJYxq5dwAv #SEO,2019-05-23 17:13:04,Advice_Local,SocialOomph,1131608997759508481,https://twitter.com/statuses/1131608997759508481
What Matters To Google: Ranking Factors in 2019 #seo #searchengineoptimization https://t.co/23XpEprIPo,2019-05-23 17:11:34,assistantbecky,RecurPost - Social Scheduler App,1131608623556251654,https://twitter.com/statuses/1131608623556251654
Research: How Y Combinator Graduates Hacked the Website Traffic Growth https://t.co/rxld15HAD5 via @semrush #SEO #GrowthHacking,2019-05-23 17:10:00,bassaganas,Buffer,1131608228377309184,https://twitter.com/statuses/1131608228377309184
Research: How Y Combinator Graduates Hacked the Website Traffic Growth https://t.co/jqINQxcAxX #SEO,2019-05-23 17:08:02,writingforseo,Buffer,1131607734078644224,https://twitter.com/statuses/1131607734078644224
"""In a world where utilizing voice search has become as common place as having a morning cup of coffee, it's important that your strategy continues to evolve to keep up with the times.""

https://t.co/Ij7L9orDPq

#seo #marketingtips",2019-05-23 17:07:59,LittleBirdMktg,HubSpot,1131607720451354629,https://twitter.com/statuses/1131607720451354629
Discover how you can utilize conscious entrepreneur principles to become successful! Listen https://t.co/PIDTPJ717B jvcrum coaching #seo,2019-05-23 17:07:51,cmwealth,SocialOomph,1131607685345021952,https://twitter.com/statuses/1131607685345021952
"#Socialmedia affects #SEO, but to what extent? https://t.co/U1JdmvZDbb",2019-05-23 17:07:01,WideFocusCo,Sprout Social,1131607475436904449,https://twitter.com/statuses/1131607475436904449
hreflang tags  What to include? https://t.co/lXXMMPZjzo #SEO,2019-05-23 17:06:03,SEOPit,IFTTT,1131607232439816192,https://twitter.com/statuses/1131607232439816192
"Instagram users want to engage, not to passively scroll. As such, remember to bring your hottest and very best content over to the 'gram. 

Always remember to keep it bite-sized, though.

To learn about Steady Demand's white label..(https://t.co/w7SHwB8jO7) #facebook #seo https://t.co/hMmAYwIVNq",2019-05-23 17:05:16,SteadyDemand,Social Media Publisher App ,1131607038688210945,https://twitter.com/statuses/1131607038688210945
Interesting tips thanks to Kristina Lazarevic @Builtvisible - https://t.co/8XBuqPjS9A #SEO #marketingstrategy https://t.co/dbRLbxL3wV,2019-05-23 17:02:45,SocialAmyW,Buffer,1131606402974343169,https://twitter.com/statuses/1131606402974343169
"Two more reasons for keeping multiple sites, instead of merging them together: 1. For testing purposes/risk separation obviously. 2. Multiple revenue streams allow you to sell a property without losing your entire business income. #SEO https://t.co/kug5YItqUf",2019-05-23 17:02:22,RemcoTensen,Twitter for Android,1131606309026127872,https://twitter.com/statuses/1131606309026127872
Advanced Google Search Operators Supercharging Your Queries  https://t.co/vjyTpliTDT | #SEO #ContentMarketing,2019-05-23 17:02:10,Chatwee,Twitter Web Client,1131606254877650949,https://twitter.com/statuses/1131606254877650949
"3 Digital Marketing Agency Client Flubs You Must Avoid

#seo #marketing
https://t.co/xrIMJKQ4m5 https://t.co/mHE7NGjNvu",2019-05-23 17:02:05,MarshaCollier,Buffer,1131606233952206848,https://twitter.com/statuses/1131606233952206848
"For beginners and long-time enthusiasts alike, this is the #SEO keywording class for you. Sign up using this link for 2 months free on @skillshare where you'll gain access to 28,000+ classes on everything from writing to #entrepreneurship: https://t.co/OVipvZdM3F https://t.co/OdZ57S4N5j",2019-05-23 17:01:56,MaddyOsman,Hootsuite Inc.,1131606198300618753,https://twitter.com/statuses/1131606198300618753
5 tips for successful #SEO https://t.co/o0ZvGWnlYT via @CQmarketing,2019-05-23 17:00:59,JohnMTrader,Buffer,1131605957124022274,https://twitter.com/statuses/1131605957124022274
Dealing with that dreaded duplicate content https://t.co/JJSl5OBMTU #SEO,2019-05-23 17:00:51,caplesweb,Hootsuite Inc.,1131605924920082432,https://twitter.com/statuses/1131605924920082432
"This year, we already experienced a broad core algorithm by #Google and more are sure to come as the year unfolds. So, what does all this mean and what should you be doing from an #SEO perspective? Read our blog post: https://t.co/qiXlXNhr2P https://t.co/ubm1YLEj3H",2019-05-23 17:00:27,emagineusa,Buffer,1131605824701444096,https://twitter.com/statuses/1131605824701444096
"SEMrush Pricing Plans: Which One is Best for You? If this is a question you need answers to, you're in the right place!  https://t.co/ysKBBNO0Y8 via @ecomplatforms #SEO",2019-05-23 17:00:26,DiviTutorials,Buffer,1131605822407102464,https://twitter.com/statuses/1131605822407102464
12 Steps To Increase Website Traffic https://t.co/ckl1NhuHYL / #SEO #DigitalMarketing https://t.co/9RP3y72xNt,2019-05-23 17:00:21,MikeSchiemer,SocialOomph,1131605801133588480,https://twitter.com/statuses/1131605801133588480
"#SEO is central to any small business marketing approach, but if you want to help your ranking, you also need to keep user engagement in mind. Here's why: https://t.co/116qmwx732 #smallbiz https://t.co/dr14MVOYmc",2019-05-23 17:00:13,jeanhanson,Emphatic,1131605766421532672,https://twitter.com/statuses/1131605766421532672
"Seasonal Sales Associate - Famous Footwear job - Famous Footwear - Tempe, AZ #seo #write https://t.co/DfNwhWrLkt",2019-05-23 16:57:44,ronc4u,ContentStudio.io,1131605140903997442,https://twitter.com/statuses/1131605140903997442
"You can gain competitive SERPs with mostly off-site SEO factors (that's backlinks), but you can't gain competitive SERPs with mostly on-site #SEO factors (that's content). - David Law",2019-05-23 16:54:02,SEOGoldUK,seotweetnow,1131604208812118017,https://twitter.com/statuses/1131604208812118017
"#SEO Career Day: Avinash Conda, retail high-flyer and SEO expert shares his path to success https://t.co/a7e5GsjfBx",2019-05-23 16:50:34,highupseo,IFTTT,1131603339249168384,https://twitter.com/statuses/1131603339249168384
#SEO Google Lighthouse Success Stories: Improving Performance with Technical Optimization https://t.co/pvQCaUOTuQ,2019-05-23 16:50:34,highupseo,IFTTT,1131603336933912577,https://twitter.com/statuses/1131603336933912577
Anyone see large fluctuations in Google yesterday? I did! #seo,2019-05-23 16:46:24,johnelincoln,Twitter for Android,1131602287229513728,https://twitter.com/statuses/1131602287229513728
Nine types of meta descriptions that win more clicks https://t.co/uksow0GDCw #Content #SEO via @sewatch,2019-05-23 16:46:02,AnaLuciaNovak,Twitter Web Client,1131602196884103168,https://twitter.com/statuses/1131602196884103168
How to Create Outstanding Long-Form Articles in WordPress https://t.co/gCcee9E0YB #SEO #contentmarketing @kinsta,2019-05-23 16:46:00,SocialSavvyMatt,Buffer,1131602189368156163,https://twitter.com/statuses/1131602189368156163
SearchSpring acquired by venture equity firm Scaleworks #SEO https://t.co/RgwcXavmDL,2019-05-23 16:44:37,PhrasingInc,IFTTT,1131601838078398464,https://twitter.com/statuses/1131601838078398464
SearchSpring acquired by venture equity firm Scaleworks #SEO https://t.co/JEpwFOBzSS,2019-05-23 16:42:19,ElitLasVegasSEO,IFTTT,1131601262439485443,https://twitter.com/statuses/1131601262439485443
How Kindness Makes Your Content More Successful https://t.co/RyGYh7cFyB  #contentmarketing #seo https://t.co/rlpyk533WP,2019-05-23 16:41:15,alvinlindsay21,The Social Jukebox,1131600994540904448,https://twitter.com/statuses/1131600994540904448
Do you have a design discipline? Submit your design-related articles to https://t.co/HB38NtE8Y5 #seo https://t.co/miMk0d8WBs,2019-05-23 16:40:09,banners_maker,Hootsuite Inc.,1131600717586866176,https://twitter.com/statuses/1131600717586866176
"Just a few spots left! @alejandrogm will be joining our #Webinar. Alejandro has been working for around 10 years doing SEO for all sizes companies such as https://t.co/n4PR4ycuNE, Budweiser, VoiceBunny, Globant, etc. Sign up here and learn how PR can boost your #SEO.",2019-05-23 16:39:37,PublicizePR,Twitter Ads Composer,1131600582756720642,https://twitter.com/statuses/1131600582756720642
